DATASET,REQUIRED_METADATA,SCIENTIFIC_PURPOSE,DECISION
CORE_EDUCATIONAL_DATASET,dataset_version export_timestamp consent_scope schema_version,Architecture reproducibility,AUDIT
DATASET_KOLB_LONGITUDINAL,dataset_version instrument_version export_timestamp schema_version,Digital psychometrics reproducibility,FREEZE
DATASET_FEATURE_STORE,dataset_version feature_version model_ready_timestamp schema_version,XAI reproducibility,AUDIT
DATASET_RECOMMENDATIONS,dataset_version recommendation_engine_version export_timestamp,Adaptive engine validation,AUDIT
DATASET_EXPERIMENT_REGISTRY,experiment_id algorithm seed dataset_version metrics,ML reproducibility,AUDIT
DATASET_RESEARCH_EVIDENCE,audit_version evidence_source export_timestamp,AI governance traceability,AUDIT
